"","X","Title","Author","Subject","Abstract","Meta"
"1",1,"adaptive extraction network for multivariate long sequence time-series forecasting","dandan zhang, yun wang","machine learning (cs.lg)","models employing cnn architecture have made significant progress in multivariate long sequence time-series forecasting (mlstf), particularly in modeling local time series characteristics. however, during the mlstf process, extracting the global time series patterns and understanding the correlations among different variables are highly significant. to address this challenge, we introduce multi-resolution convolution and deformable convolution operations. by enlarging the receptive field using convolution kernels with different dilation factors to capture temporal correlation information across different resolutions, and adaptively adjusting the sampling positions through additional offset vectors, we enhance the network's ability to capture correlated features between variables. building upon this, we propose atvcnet, an adaptive temporal-variable convolutional network designed to effectively model the local/global temporal dependencies and inter-variable dependencies of multivariate time series. specifically, extracting and fusing time series features at different resolutions, captures both local contextual information and global patterns in the time series. the designed inter-variable feature adaptive extraction module captures the correlation among different variables in the time series. we evaluated the performance of atvcnet across eight real-world datasets. the results indicate that atvcnet achieved a performance improvement of approximately .% over state-of-the-art mlstf models.",2024-05-20
"2",2,"quantifying individual and joint module impact in modular optimization frameworks","ana nikolikj, ana kostovska, diederick vermetten, carola doerr, tome eftimov","neural and evolutionary computing (cs.ne)","this study explores the influence of modules on the performance of modular optimization frameworks for continuous single-objective black-box optimization. there is an extensive variety of modules to choose from when designing algorithm variants, however, there is a rather limited understanding of how each module individually influences the algorithm performance and how the modules interact with each other when combined. we use the functional anova (f-anova) framework to quantify the influence of individual modules and module combinations for two algorithms, the modular covariance matrix adaptation (modcma) and the modular differential evolution (modde). we analyze the performance data from  modcma and  modde variants on the bbob benchmark collection, for two problem dimensions, and three computational budgets. noteworthy findings include the identification of important modules that strongly influence the performance of modcma, such as the~\textit{weights\ option} and~\textit{mirrored} modules for low dimensional problems, and the~\textit{base\ sampler} for high dimensional problems. the large individual influence of the~\textit{lpsr} module makes it very important for the performance of modde, regardless of the problem dimensionality and the computational budget. when comparing modcma and modde, modde undergoes a shift from individual modules being more influential, to module combinations being more influential, while modcma follows the opposite pattern, with an increase in problem dimensionality and computational budget.",2024-05-20
"3",3,"depth prompting for sensor-agnostic depth estimation","jin-hwi park, chanhwi jeong, junoh lee, hae-gon jeon","computer vision and pattern recognition (cs.cv)","dense depth maps have been used as a key element of visual perception tasks. there have been tremendous efforts to enhance the depth quality, ranging from optimization-based to learning-based methods. despite the remarkable progress for a long time, their applicability in the real world is limited due to systematic measurement biases such as density, sensing pattern, and scan range. it is well-known that the biases make it difficult for these methods to achieve their generalization. we observe that learning a joint representation for input modalities (e.g., images and depth), which most recent methods adopt, is sensitive to the biases. in this work, we disentangle those modalities to mitigate the biases with prompt engineering. for this, we design a novel depth prompt module to allow the desirable feature representation according to new depth distributions from either sensor types or scene configurations. our depth prompt can be embedded into foundation models for monocular depth estimation. through this embedding process, our method helps the pretrained model to be free from restraint of depth scan range and to provide absolute scale depth maps. we demonstrate the effectiveness of our method through extensive evaluations. source code is publicly available at this https url .",2024-05-20
"4",4,"tinyllava factory: a modularized codebase for small-scale large multimodal models","junlong jia, ying hu, xi weng, yiming shi, miao li, xingjian zhang, baichuan zhou, ziyu liu, jie luo, lei huang, ji wu","machine learning (cs.lg)","we present tinyllava factory, an open-source modular codebase for small-scale large multimodal models (lmms) with a focus on simplicity of code implementations, extensibility of new features, and reproducibility of training results. following the design philosophy of the factory pattern in software engineering, tinyllava factory modularizes the entire system into interchangeable components, with each component integrating a suite of cutting-edge models and methods, meanwhile leaving room for extensions to more features. in addition to allowing users to customize their own lmms, tinyllava factory provides popular training recipes to let users pretrain and finetune their models with less coding effort. empirical experiments validate the effectiveness of our codebase. the goal of tinyllava factory is to assist researchers and practitioners in exploring the wide landscape of designing and training small-scale lmms with affordable computational resources.",2024-05-20
"5",5,"analyze additive and interaction effects via collaborative trees","chien-ming chi","methodology (stat.me)","we present collaborative trees, a novel tree model designed for regression prediction, along with its bagging version, which aims to analyze complex statistical associations between features and uncover potential patterns inherent in the data. we decompose the mean decrease in impurity from the proposed tree model to analyze the additive and interaction effects of features on the response variable. additionally, we introduce network diagrams to visually depict how each feature contributes additively to the response and how pairs of features contribute interaction effects. through a detailed demonstration using an embryo growth dataset, we illustrate how the new statistical tools aid data analysis, both visually and numerically. moreover, we delve into critical aspects of tree modeling, such as prediction performance, inference stability, and bias in feature importance measures, leveraging real datasets and simulation experiments for comprehensive discussions. on the theory side, we show that collaborative trees, built upon a ``sum of trees'' approach with our own innovative tree model regularization, exhibit characteristics akin to matching pursuit, under the assumption of high-dimensional independent binary input features (or one-hot feature groups). this newfound link sheds light on the superior capability of our tree model in estimating additive effects of features, a crucial factor for accurate interaction effect estimation.",2024-05-19
"6",6,"mediclip: adapting clip for few-shot medical image anomaly detection","ximiao zhang, min xu, dehui qiu, ruixin yan, ning lang, xiuzhuang zhou","computer vision and pattern recognition (cs.cv)","in the field of medical decision-making, precise anomaly detection in medical imaging plays a pivotal role in aiding clinicians. however, previous work is reliant on large-scale datasets for training anomaly detection models, which increases the development cost. this paper first focuses on the task of medical image anomaly detection in the few-shot setting, which is critically significant for the medical field where data collection and annotation are both very expensive. we propose an innovative approach, mediclip, which adapts the clip model to few-shot medical image anomaly detection through self-supervised fine-tuning. although clip, as a vision-language model, demonstrates outstanding zero-/fewshot performance on various downstream tasks, it still falls short in the anomaly detection of medical images. to address this, we design a series of medical image anomaly synthesis tasks to simulate common disease patterns in medical imaging, transferring the powerful generalization capabilities of clip to the task of medical image anomaly detection. when only few-shot normal medical images are provided, mediclip achieves state-of-the-art performance in anomaly detection and location compared to other methods. extensive experiments on three distinct medical anomaly detection tasks have demonstrated the superiority of our approach. the code is available at this https url.",2024-05-18
"7",7,"simad: a simple dissimilarity-based approach for time series anomaly detection","zhijie zhong, zhiwen yu, xing xi, yue xu, jiahui chen, kaixiang yang","machine learning (cs.lg)","despite the prevalence of reconstruction-based deep learning methods, time series anomaly detection remains challenging. existing approaches often struggle with limited temporal contexts, inadequate representation of normal patterns, and flawed evaluation metrics, hindering their effectiveness in identifying aberrant behavior. to address these issues, we introduce $\textbf{simad}$, a $\textbf{sim}$ple dissimilarity-based approach for time series $\textbf{a}$nomaly $\textbf{d}$etection. simad incorporates an advanced feature extractor adept at processing extended temporal windows, utilizes the embedpatch encoder to integrate normal behavioral patterns comprehensively, and introduces an innovative contrastfusion module designed to accentuate distributional divergences between normal and abnormal data, thereby enhancing the robustness of anomaly discrimination. additionally, we propose two robust evaluation metrics, uaff and naff, addressing the limitations of existing metrics and demonstrating their reliability through theoretical and experimental analyses. experiments across $\textbf{seven}$ diverse time series datasets demonstrate simad's superior performance compared to state-of-the-art methods, achieving relative improvements of $\textbf{.%}$ on f, $\textbf{.%}$ on aff-f, $\textbf{.%}$ on naff-f, and $\textbf{.%}$ on auc on six multivariate datasets. code and pre-trained models are available at this https url.",2024-05-18
"8",8,"simulation and design of isostatic thick origami structures","andrea micheletti, alessandro tiero, giuseppe tomassetti","soft condensed matter (cond-mat.soft)","thick origami structures are considered here as assemblies of polygonal panels hinged to each other along their edges according to a corresponding origami crease pattern. the determination of the internal actions caused by external loads in such structures is not an easy task, owing to their high degree of static indeterminacy, and the likelihood of unwanted self-balanced internal actions induced by manufacturing imperfections. here we present a method for reducing the degree of static indeterminacy which can be applied to several thick origami structures to make them isostatic. the method utilizes sliding hinges, which permit also the relative translation along the hinge axis, to replace conventional hinges. after giving the analytical description of both types of hinges and describing a rigid folding simulation procedure based on the integration of the exponential map, we present the static analysis of a series of noteworthy examples based on the miura-ori pattern, the yoshimura pattern, and the kresling pattern. the method can be applied for the design and realization of thick origami structures with adequate strength to resist external actions.",2024-04-28
"9",9,"vqdna: unleashing the power of vector quantization for multi-species genomic sequence modeling","siyuan li, zedong wang, zicheng liu, di wu, cheng tan, jiangbin zheng, yufei huang, stan z. li","genomics (q-bio.gn)","similar to natural language models, pre-trained genome language models are proposed to capture the underlying intricacies within genomes with unsupervised sequence modeling. they have become essential tools for researchers and practitioners in biology. however, the \textit{hand-crafted} tokenization policies used in these models may not encode the most discriminative patterns from the limited vocabulary of genomic data. in this paper, we introduce vqdna, a general-purpose framework that renovates genome tokenization from the perspective of genome vocabulary learning. by leveraging vector-quantized codebook as \textit{learnable} vocabulary, vqdna can adaptively tokenize genomes into \textit{pattern-aware} embeddings in an end-to-end manner. to further push its limits, we propose hierarchical residual quantization (hrq), where varying scales of codebooks are designed in a hierarchy to enrich the genome vocabulary in a coarse-to-fine manner. extensive experiments on  genome datasets demonstrate vqdna's superiority and favorable parameter efficiency compared to existing genome language models. notably, empirical analysis of sars-cov- mutations reveals the fine-grained pattern awareness and biological significance of learned hrq vocabulary, highlighting its untapped potential for broader applications in genomics.",2024-05-13
"10",10,"chatgpt in classrooms: transforming challenges into opportunities in education","harris bin munawar, nikolaos misirlis","computers and society (cs.cy)","in the era of exponential technology growth, one unexpected guest has claimed a seat in classrooms worldwide, artificial intelligence. generative ai, such as chatgpt, promises a revolution in education, yet it arrives with a double-edged sword. its potential for personalized learning is offset by issues of cheating, inaccuracies, and educators struggling to incorporate it effectively into their lesson design. we are standing on the brink of this educational frontier, and it is clear that we need to navigate this terrain with a lot of care. this is a major challenge that could undermine the integrity and value of our educational process. so, how can we turn these challenges into opportunities? when used inappropriately, ai tools can become the perfect tool for the cut copy paste mentality, and quickly begin to corrode critical thinking, creativity, and deep understanding, the most important skills in our rapidly changing world. teachers feel that they are not equipped to leverage this technology, widening the digital divide among educators and institutions. addressing these concerns calls for an in depth research approach. we will employ empirical research, drawing on the technology acceptance model, to assess the attitudes toward generative ai among educators and students. understanding their perceptions, usage patterns, and hurdles is the first crucial step in creating an effective solution. the present study will be used as a process manual for future researchers to apply, running their own data, based on the steps explained here",2024-05-17
"11",11,"unicl: a universal contrastive learning framework for large time series models","jiawei li, jingshu peng, haoyang li, lei chen","machine learning (cs.lg)","time-series analysis plays a pivotal role across a range of critical applications, from finance to healthcare, which involves various tasks, such as forecasting and classification. to handle the inherent complexities of time-series data, such as high dimensionality and noise, traditional supervised learning methods first annotate extensive labels for time-series data in each task, which is very costly and impractical in real-world applications. in contrast, pre-trained foundation models offer a promising alternative by leveraging unlabeled data to capture general time series patterns, which can then be fine-tuned for specific tasks. however, existing approaches to pre-training such models typically suffer from high-bias and low-generality issues due to the use of predefined and rigid augmentation operations and domain-specific data training. to overcome these limitations, this paper introduces unicl, a universal and scalable contrastive learning framework designed for pretraining time-series foundation models across cross-domain datasets. specifically, we propose a unified and trainable time-series augmentation operation to generate pattern-preserved, diverse, and low-bias time-series data by leveraging spectral information. besides, we introduce a scalable augmentation algorithm capable of handling datasets with varying lengths, facilitating cross-domain pretraining. extensive experiments on two benchmark datasets across eleven domains validate the effectiveness of unicl, demonstrating its high generalization on time-series analysis across various fields.",2024-05-17
"12",12,"multi-scale semantic prior features guided deep neural network for urban street-view image","jianshun zeng, wang li, yanjie lv, shuai gao, yuchu qin","computer vision and pattern recognition (cs.cv)","street-view image has been widely applied as a crucial mobile mapping data source. the inpainting of street-view images is a critical step for street-view image processing, not only for the privacy protection, but also for the urban environment mapping applications. this paper presents a novel deep neural network (dnn), multi-scale semantic prior feature guided image inpainting network (mfn) for inpainting street-view images, which generate static street-view images without moving objects (e.g., pedestrians, vehicles). to enhance global context understanding, a semantic prior prompter is introduced to learn rich semantic priors from large pre-trained model. we design the prompter by stacking multiple semantic pyramid aggregation (spa) modules, capturing a broad range of visual feature patterns. a semantic-enhanced image generator with a decoder is proposed that incorporates a novel cascaded learnable prior transferring (lpt) module at each scale level. for each decoder block, an attention transfer mechanism is applied to capture long-term dependencies, and the semantic prior features are fused with the image features to restore plausible structure in an adaptive manner. additionally, a background-aware data processing scheme is adopted to prevent the generation of hallucinated objects within holes. experiments on apolloscapes and cityscapes datasets demonstrate better performance than state-of-the-art methods, with mae, and lpips showing improvements of about .% and .% respectively. visual comparison survey among multi-group person is also conducted to provide performance evaluation, and the results suggest that the proposed mfn offers a promising solution for privacy protection and generate more reliable scene for urban applications with street-view images.",2024-05-17
"13",13,"a deep learning approach to heterogeneous consumer aesthetics in retail fashion","pranjal rawat","general economics (econ.gn)","in some markets, the visual appearance of a product matters a lot. this paper investigates consumer transactions from a major fashion retailer, focusing on consumer aesthetics. pretrained multimodal models convert images and text descriptions into high-dimensional embeddings. the value of these embeddings is verified both empirically and by their ability to segment the product space. a discrete choice model is used to decompose the distinct drivers of consumer choice: price, visual aesthetics, descriptive details, and seasonal variations. consumers are allowed to differ in their preferences over these factors, both through observed variation in demographics and allowing for unobserved types. estimation and inference employ automatic differentiation and gpus, making it scalable and portable. the model reveals significant differences in price sensitivity and aesthetic preferences across consumers. the model is validated by its ability to predict the relative success of new designs and purchase patterns.",2024-05-17
"14",14,"agent design pattern catalogue: a collection of architectural patterns for foundation model based agents","yue liu, sin kit lo, qinghua lu, liming zhu, dehai zhao, xiwei xu, stefan harrer, jon whittle","artificial intelligence (cs.ai)","foundation model-enabled generative artificial intelligence facilitates the development and implementation of agents, which can leverage distinguished reasoning and language processing capabilities to takes a proactive, autonomous role to pursue users' goals. nevertheless, there is a lack of systematic knowledge to guide practitioners in designing the agents considering challenges of goal-seeking (including generating instrumental goals and plans), such as hallucinations inherent in foundation models, explainability of reasoning process, complex accountability, etc. to address this issue, we have performed a systematic literature review to understand the state-of-the-art foundation model-based agents and the broader ecosystem. in this paper, we present a pattern catalogue consisting of  architectural patterns with analyses of the context, forces, and trade-offs as the outcomes from the previous literature review. the proposed catalogue can provide holistic guidance for the effective use of patterns, and support the architecture design of foundation model-based agents by facilitating goal-seeking and plan generation.",2024-05-16
"15",15,"amcen: an attention masking-based contrastive event network for two-stage temporal knowledge graph reasoning","jing yang, xiao wang, yutong wang, jiawei wang, fei-yue wang","machine learning (cs.lg)","temporal knowledge graphs (tkgs) can effectively model the ever-evolving nature of real-world knowledge, and their completeness and enhancement can be achieved by reasoning new events from existing ones. however, reasoning accuracy is adversely impacted due to an imbalance between new and recurring events in the datasets. to achieve more accurate tkg reasoning, we propose an attention masking-based contrastive event network (amcen) with local-global temporal patterns for the two-stage prediction of future events. in the network, historical and non-historical attention mask vectors are designed to control the attention bias towards historical and non-historical entities, acting as the key to alleviating the imbalance. a local-global message-passing module is proposed to comprehensively consider and capture multi-hop structural dependencies and local-global temporal evolution for the in-depth exploration of latent impact factors of different event types. a contrastive event classifier is used to classify events more accurately by incorporating local-global temporal patterns into contrastive learning. therefore, amcen refines the prediction scope with the results of the contrastive event classification, followed by utilizing attention masking-based decoders to finalize the specific outcomes. the results of our experiments on four benchmark datasets highlight the superiority of amcen. especially, the considerable improvements in hits@ prove that amcen can make more precise predictions about future occurrences.",2024-05-16
"16",16,"a design trajectory map of human-ai collaborative reinforcement learning systems: survey and taxonomy","zhaoxing li","human-computer interaction (cs.hc)","driven by the algorithmic advancements in reinforcement learning and the increasing number of implementations of human-ai collaboration, collaborative reinforcement learning (crl) has been receiving growing attention. despite this recent upsurge, this area is still rarely systematically studied. in this paper, we provide an extensive survey, investigating crl methods based on both interactive reinforcement learning algorithms and human-ai collaborative frameworks that were proposed in the past decade. we elucidate and discuss via synergistic analysis methods both the growth of the field and the state-of-the-art; we conceptualise the existing frameworks from the perspectives of design patterns, collaborative levels, parties and capabilities, and review interactive methods and algorithmic models. specifically, we create a new human-ai crl design trajectory map, as a systematic modelling tool for the selection of existing crl frameworks, as well as a method of designing new crl systems, and finally of improving future crl designs. furthermore, we elaborate generic human-ai crl challenges, providing the research community with a guide towards novel research directions. the aim of this paper is to empower researchers with a systematic framework for the design of efficient and 'natural' human-ai collaborative methods, making it possible to work on maximised realisation of humans' and ai's potentials.",2024-05-16
